{
 "$schema": "http://json-schema.org/draft-07/schema#",
 "title": "BThwaniProductTruthContract",
 "type": "object",
 "additionalProperties": false,
 "required": [
 "schemaVersion",
 "capabilityId",
 "state",
 "problem",
 "actors",
 "surfaces",
 "outcome",
 "acceptance",
 "invariants",
 "owners",
 "execution"
 ],
 "properties": {
 "schemaVersion": { "const": 1 },
 "capabilityId": {
 "type": "string",
 "pattern": "^[A-Z0-9][A-Z0-9_-]+$"
 },
 "state": {
 "enum": [
 "DISCOVERY",
 "PRODUCT_MODEL_APPROVED",
 "READY_FOR_IMPLEMENTATION",
 "IMPLEMENTED",
 "PRODUCT_ACCEPTED",
 "RETIRED"
 ]
 },
 "problem": {
 "type": "object",
 "additionalProperties": false,
 "required": ["statement", "affectedActors", "currentWorkaround", "evidenceState"],
 "properties": {
 "statement": { "type": "string", "minLength": 10 },
 "affectedActors": {
 "type": "array",
 "minItems": 1,
 "uniqueItems": true,
 "items": { "type": "string", "minLength": 1 }
 },
 "currentWorkaround": { "type": "string", "minLength": 1 },
 "frequency": { "enum": ["unknown", "rare", "occasional", "frequent", "continuous"] },
 "severity": { "enum": ["unknown", "low", "medium", "high", "critical"] },
 "evidenceState": { "enum": ["UNPROVEN", "QUALITATIVE", "QUANTITATIVE", "VALIDATED"] },
 "evidenceReferences": {
 "type": "array",
 "uniqueItems": true,
 "items": { "type": "string", "minLength": 1 }
 }
 }
 },
 "actors": {
 "type": "array",
 "minItems": 1,
 "items": {
 "type": "object",
 "additionalProperties": false,
 "required": ["id", "role", "permittedActions", "forbiddenActions"],
 "properties": {
 "id": { "type": "string", "pattern": "^[a-z0-9_-]+$" },
 "role": { "type": "string", "minLength": 1 },
 "permittedActions": {
 "type": "array",
 "uniqueItems": true,
 "items": { "type": "string", "minLength": 1 }
 },
 "forbiddenActions": {
 "type": "array",
 "minItems": 1,
 "uniqueItems": true,
 "items": { "type": "string", "minLength": 1 }
 }
 }
 }
 },
 "surfaces": {
 "type": "array",
 "minItems": 1,
 "items": {
 "type": "object",
 "additionalProperties": false,
 "required": ["id", "required", "actors", "states", "actions"],
 "properties": {
 "id": {
 "enum": [
 "app-client",
 "app-partner",
 "app-captain",
 "app-field",
 "control-panel",
 "backend",
 "database",
 "shared"
 ]
 },
 "required": { "type": "boolean" },
 "exclusionReason": { "type": "string", "minLength": 1 },
 "actors": {
 "type": "array",
 "minItems": 1,
 "uniqueItems": true,
 "items": { "type": "string", "minLength": 1 }
 },
 "routesOrScreens": {
 "type": "array",
 "uniqueItems": true,
 "items": { "type": "string", "minLength": 1 }
 },
 "operationIds": {
 "type": "array",
 "uniqueItems": true,
 "items": { "type": "string", "minLength": 1 }
 },
 "states": {
 "type": "array",
 "minItems": 1,
 "uniqueItems": true,
 "items": { "type": "string", "minLength": 1 }
 },
 "actions": {
 "type": "array",
 "uniqueItems": true,
 "items": { "type": "string", "minLength": 1 }
 }
 },
 "allOf": [
 {
 "if": { "properties": { "required": { "const": false } } },
 "then": { "required": ["exclusionReason"] }
 }
 ]
 }
 },
 "outcome": {
 "type": "object",
 "additionalProperties": false,
 "required": ["statement", "primaryMetric", "baselineState", "targetState"],
 "properties": {
 "statement": { "type": "string", "minLength": 10 },
 "primaryMetric": { "type": "string", "minLength": 1 },
 "guardrailMetrics": {
 "type": "array",
 "uniqueItems": true,
 "items": { "type": "string", "minLength": 1 }
 },
 "baselineState": { "type": "string", "minLength": 1 },
 "targetState": { "type": "string", "minLength": 1 },
 "observationWindow": { "type": "string", "minLength": 1 }
 }
 },
 "acceptance": {
 "type": "object",
 "additionalProperties": false,
 "required": ["criteria", "failureStates", "requiredChecks"],
 "properties": {
 "criteria": {
 "type": "array",
 "minItems": 1,
 "uniqueItems": true,
 "items": { "type": "string", "minLength": 1 }
 },
 "failureStates": {
 "type": "array",
 "minItems": 1,
 "uniqueItems": true,
 "items": { "type": "string", "minLength": 1 }
 },
 "requiredChecks": {
 "type": "array",
 "minItems": 1,
 "uniqueItems": true,
 "items": { "type": "string", "minLength": 1 }
 },
 "runtimeEvidenceRequired": { "type": "boolean" },
 "visualEvidenceRequired": { "type": "boolean" }
 }
 },
 "invariants": {
 "type": "object",
 "additionalProperties": false,
 "required": ["business", "negative"],
 "properties": {
 "business": {
 "type": "array",
 "minItems": 1,
 "uniqueItems": true,
 "items": { "type": "string", "minLength": 1 }
 },
 "negative": {
 "type": "array",
 "minItems": 1,
 "uniqueItems": true,
 "items": { "type": "string", "minLength": 1 }
 }
 }
 },
 "owners": {
 "type": "object",
 "additionalProperties": false,
 "required": ["productManager", "productOwner", "engineeringOwner"],
 "properties": {
 "productManager": { "type": "string", "minLength": 1 },
 "productOwner": { "type": "string", "minLength": 1 },
 "uxJourneyOwner": { "type": "string", "minLength": 1 },
 "engineeringOwner": { "type": "string", "minLength": 1 },
 "productManagerApproval": { "enum": ["PENDING", "APPROVED", "REJECTED"] },
 "productOwnerApproval": { "enum": ["PENDING", "APPROVED", "REJECTED"] },
 "productAcceptanceDecision": { "enum": ["PENDING", "PASS", "FIX_REQUIRED"] }
 }
 },
 "execution": {
 "type": "object",
 "additionalProperties": false,
 "required": ["appetite", "fixedConstraints", "variableScope", "forbiddenScope"],
 "properties": {
 "appetite": { "type": "string", "minLength": 1 },
 "fixedConstraints": {
 "type": "array",
 "minItems": 1,
 "uniqueItems": true,
 "items": { "type": "string", "minLength": 1 }
 },
 "variableScope": {
 "type": "array",
 "uniqueItems": true,
 "items": { "type": "string", "minLength": 1 }
 },
 "forbiddenScope": {
 "type": "array",
 "minItems": 1,
 "uniqueItems": true,
 "items": { "type": "string", "minLength": 1 }
 },
 "forecastRange": { "type": "string", "minLength": 1 },
 "confidence": { "enum": ["low", "medium", "high"] },
 "unknowns": {
 "type": "array",
 "uniqueItems": true,
 "items": { "type": "string", "minLength": 1 }
 }
 }
 },
 "platformModel": {
 "type": "object",
 "additionalProperties": false,
 "required": [
 "classification",
 "actors",
 "captainAffiliations",
 "fulfillmentModes",
 "partnerCommercialModels",
 "contextSemantics",
 "ownership"
 ],
 "properties": {
 "classification": {
 "const": "UNIFIED_MULTI_SURFACE_B2B2C_COMMERCE_FULFILLMENT_FINANCIAL_PLATFORM"
 },

 "actors": {
 "type": "array",
 "minItems": 5,
 "maxItems": 5,
 "uniqueItems": true,
 "items": { "enum": ["OPERATOR", "PARTNER", "CAPTAIN", "FIELD", "CUSTOMER"] }
 },
 "captainAffiliations": {
 "type": "array",
 "minItems": 2,
 "maxItems": 2,
 "uniqueItems": true,
 "items": { "enum": ["BTHWANI", "PARTNER"] }
 },
 "fulfillmentModes": {
 "type": "array",
 "minItems": 1,
 "uniqueItems": true,
 "items": {
 "enum": ["BTHWANI_CAPTAIN", "PARTNER_CAPTAIN", "PARTNER_SELF_FULFILLMENT", "CUSTOMER_PICKUP"]
 }
 },
 "partnerCommercialModels": {
 "type": "array",
 "minItems": 1,
 "uniqueItems": true,
 "items": { "enum": ["COMMISSION", "SUBSCRIPTION", "HYBRID", "OPERATOR_MANAGED"] }
 },
 "contextSemantics": {
 "type": "object",
 "additionalProperties": false,
 "required": ["platformContext", "operatorContext", "operatorContextPurpose", "partnerOrganization", "store"],
 "properties": {
 "platformContext": { "const": "PLATFORM_ISOLATION_BOUNDARY" },
 "operatorContext": { "const": "TRUSTED_OPERATIONAL_CONTEXT_WITHIN_PLATFORM_CONTEXT" },
 "operatorContextPurpose": { "const": "TRUST_AND_DATA_ISOLATION" },
 "partnerOrganization": { "const": "BUSINESS_SCOPE_NOT_OPERATOR_CONTEXT" },
 "store": { "const": "BUSINESS_SCOPE_NOT_OPERATOR_CONTEXT" }
 }
 },
 "ownership": {
 "type": "object",
 "additionalProperties": false,
 "required": ["operationalTruth", "financialTruth", "applicationFinancialAccess"],
 "properties": {
 "operationalTruth": { "const": "DSH" },
 "financialTruth": { "const": "WLT" },
 "applicationFinancialAccess": { "const": "DSH_FACADE_ONLY" }
 }
 }
 }
 }
 },
 "allOf": [
 {
 "if": { "properties": { "capabilityId": { "const": "BTHWANI_PLATFORM_MODEL" } } },
 "then": { "required": ["platformModel"] }
 },
 {
 "if": {
 "properties": {
 "state": {
 "enum": ["PRODUCT_MODEL_APPROVED", "READY_FOR_IMPLEMENTATION", "IMPLEMENTED", "PRODUCT_ACCEPTED"]
 }
 }
 },
 "then": {
 "properties": {
 "problem": {
 "properties": {
 "evidenceState": { "enum": ["QUALITATIVE", "QUANTITATIVE", "VALIDATED"] },
 "evidenceReferences": { "minItems": 1 }
 },
 "required": ["evidenceReferences"]
 },
 "owners": {
 "properties": { "productManagerApproval": { "const": "APPROVED" } },
 "required": ["productManagerApproval"]
 }
 }
 }
 },
 {
 "if": {
 "properties": {
 "state": { "enum": ["READY_FOR_IMPLEMENTATION", "IMPLEMENTED", "PRODUCT_ACCEPTED"] }
 }
 },
 "then": {
 "properties": {
 "owners": {
 "properties": { "productOwnerApproval": { "const": "APPROVED" } },
 "required": ["productOwnerApproval"]
 }
 }
 }
 },
 {
 "if": { "properties": { "state": { "const": "PRODUCT_ACCEPTED" } } },
 "then": {
 "properties": {
 "owners": {
 "properties": { "productAcceptanceDecision": { "const": "PASS" } },
 "required": ["productAcceptanceDecision"]
 }
 }
 }
 }
 ]
}
